{
  "id": "triceps_overhead_extension",
  "name": "Overhead Triceps Extension",
  "category": "triceps",
  "primary_muscles": [
    "triceps_brachii_long_head"
  ],
  "secondary_muscles": [
    "triceps_lateral_head",
    "triceps_medial_head"
  ],
  "equipment": "dumbbell",
  "difficulty": "intermediate",
  "movement_pattern": "elbow_extension",
  "mechanics": "isolation",
  "setup": [
    "Sit on bench or stand, holding dumbbell overhead with both hands",
    "Hands cupping the inner plate of dumbbell"
  ],
  "execution": [
    "Lower dumbbell behind head by bending elbows",
    "Elbows point to ceiling, upper arms stay vertical",
    "Extend back overhead by contracting triceps"
  ],
  "tempo": "3-1-2",
  "common_mistakes": [
    "Elbows flaring outward",
    "Using momentum (rocking body)",
    "Not getting full stretch at bottom"
  ],
  "cues": [
    "Elbows pointed at the ceiling — don't let them drift",
    "Feel the stretch in the long head at the bottom"
  ],
  "variations": [
    "cable_overhead_extension",
    "single_arm_overhead_extension",
    "ez_bar_overhead_extension"
  ],
  "advantages": [
    "Hits triceps long head (unique growth stimulus)"
  ],
  "hypertrophy_rep_range": {
    "min": 8,
    "max": 15
  },
  "rest_time": {
    "min_seconds": 60,
    "max_seconds": 90,
    "label": "60-90s"
  },
  "breathing": "Exhale on concentric, inhale on eccentric",
  "alternatives": [],
  "movement_plane": "multi_planar",
  "stability_requirement": "low",
  "skill_requirement": "moderate",
  "fatigue_score": 3.0,
  "systemic_fatigue": "low",
  "joint_stress": {
    "overall": "moderate",
    "notes": ""
  },
  "force_curve": "flat",
  "resistance_profile": "constant",
  "unilateral_bilateral": "bilateral",
  "recommended_rir": {
    "min": 1,
    "max": 2,
    "description": "Leave 1-2 reps in reserve"
  },
  "muscle_contributions": [
    {
      "muscle_id": "triceps_brachii_long_head",
      "percentage": 62.5
    },
    {
      "muscle_id": "triceps_lateral_head",
      "percentage": 18.8
    },
    {
      "muscle_id": "triceps_medial_head",
      "percentage": 18.8
    }
  ],
  "tags": [],
  "knowledge_version": "1.0.0",
  "last_updated": "2026-07-02",
  "references": []
}
