{
  "id": "chest_dumbbell_fly",
  "name": "Dumbbell Chest Fly",
  "category": "chest",
  "primary_muscles": [
    "pectoralis_major"
  ],
  "secondary_muscles": [
    "anterior_deltoid"
  ],
  "equipment": "dumbbell",
  "difficulty": "intermediate",
  "movement_pattern": "horizontal_adduction",
  "mechanics": "isolation",
  "setup": [
    "Lie on flat bench, dumbbells pressed above chest",
    "Palms facing each other, arms slightly bent (~15 degrees)"
  ],
  "execution": [
    "With elbows fixed in slight bend, lower dumbbells out to sides",
    "Lower until chest stretch or shoulders say stop (not past parallel)",
    "Reverse motion, squeeze dumbbells together at top"
  ],
  "tempo": "3-1-2",
  "common_mistakes": [
    "Too much elbow bend (becomes press)",
    "Arms completely straight (shoulder strain)",
    "Range of motion too deep (shoulder injury risk)"
  ],
  "cues": [
    "Hug a tree on the concentric",
    "Elbow bend stays fixed throughout",
    "Feel the stretch in chest, not shoulders"
  ],
  "alternatives": [
    "cable_crossover",
    "pec_deck_machine"
  ],
  "aliases": [
    "DB Chest Fly"
  ],
  "hypertrophy_rep_range": {
    "min": 8,
    "max": 15
  },
  "rest_time": {
    "min_seconds": 60,
    "max_seconds": 90,
    "label": "60-90s"
  },
  "breathing": "Exhale on concentric, inhale on eccentric",
  "movement_plane": "multi_planar",
  "stability_requirement": "low",
  "skill_requirement": "moderate",
  "fatigue_score": 3.0,
  "systemic_fatigue": "low",
  "joint_stress": {
    "overall": "moderate",
    "notes": ""
  },
  "force_curve": "flat",
  "resistance_profile": "constant",
  "unilateral_bilateral": "bilateral",
  "recommended_rir": {
    "min": 1,
    "max": 2,
    "description": "Leave 1-2 reps in reserve"
  },
  "muscle_contributions": [
    {
      "muscle_id": "pectoralis_major",
      "percentage": 76.9
    },
    {
      "muscle_id": "anterior_deltoid",
      "percentage": 23.1
    }
  ],
  "tags": [],
  "knowledge_version": "1.0.0",
  "last_updated": "2026-07-02",
  "references": []
}
