{
  "id": "back_pull_up",
  "name": "Pull-Up",
  "category": "back",
  "primary_muscles": [
    "latissimus_dorsi",
    "trapezius",
    "biceps_brachii"
  ],
  "secondary_muscles": [
    "rhomboids",
    "posterior_deltoid",
    "core"
  ],
  "equipment": "pull_up_bar",
  "difficulty": "advanced",
  "movement_pattern": "vertical_pull",
  "mechanics": "compound",
  "setup": [
    "Grip bar wider than shoulder-width (palms facing away)",
    "Hang with arms fully extended, legs crossed behind",
    "Scapulae retracted and depressed (active hang)"
  ],
  "execution": [
    "Initiate by pulling shoulders down and back",
    "Pull until chin clears the bar",
    "Elbows drive down toward hips",
    "Lower under control to full hang"
  ],
  "tempo": "2-1-2",
  "common_mistakes": [
    "Kipping / using momentum",
    "Partial range of motion (not going to full hang)",
    "Chin not clearing the bar",
    "Looking up (juts chin over bar — can strain neck)"
  ],
  "cues": [
    "Pull the bar to your sternum",
    "Drive elbows back, not down",
    "Lead with your chest to the bar",
    "Squeeze glutes and brace core"
  ],
  "variations": [
    "wide_grip_pull_up",
    "neutral_grip_pull_up",
    "weighted_pull_up",
    "muscle_up"
  ],
  "progression": "Negative → Band Assisted → Strict → Weighted",
  "alternatives": [
    "lat_pulldown",
    "assisted_pull_up_machine"
  ],
  "aliases": [
    "Pull Up",
    "Pullups"
  ],
  "hypertrophy_rep_range": {
    "min": 6,
    "max": 12
  },
  "rest_time": {
    "min_seconds": 90,
    "max_seconds": 120,
    "label": "90-120s"
  },
  "breathing": "Exhale on concentric, inhale on eccentric",
  "movement_plane": "sagittal",
  "stability_requirement": "moderate",
  "skill_requirement": "high",
  "fatigue_score": 6.0,
  "systemic_fatigue": "high",
  "joint_stress": {
    "overall": "moderate",
    "notes": ""
  },
  "force_curve": "flat",
  "resistance_profile": "constant",
  "unilateral_bilateral": "bilateral",
  "recommended_rir": {
    "min": 0,
    "max": 1,
    "description": "Take close to failure, 0-1 RIR"
  },
  "muscle_contributions": [
    {
      "muscle_id": "latissimus_dorsi",
      "percentage": 25.6
    },
    {
      "muscle_id": "trapezius",
      "percentage": 25.6
    },
    {
      "muscle_id": "biceps_brachii",
      "percentage": 25.6
    },
    {
      "muscle_id": "rhomboids",
      "percentage": 7.7
    },
    {
      "muscle_id": "posterior_deltoid",
      "percentage": 7.7
    },
    {
      "muscle_id": "core",
      "percentage": 7.7
    }
  ],
  "tags": [],
  "knowledge_version": "1.0.0",
  "last_updated": "2026-07-02",
  "references": []
}
