{
  "id": "quads_goblet_squat",
  "name": "Goblet Squat",
  "category": "quads",
  "primary_muscles": [
    "quadriceps",
    "gluteus_maximus"
  ],
  "secondary_muscles": [
    "core",
    "erector_spinae",
    "hamstrings"
  ],
  "equipment": "dumbbell",
  "difficulty": "beginner",
  "movement_pattern": "squat",
  "mechanics": "compound",
  "setup": [
    "Hold one end of dumbbell at chest height with both hands",
    "Feet slightly wider than shoulder-width, toes out",
    "Elbows pointing down, dumbbell against sternum"
  ],
  "execution": [
    "Sit back and down, keeping torso upright",
    "Descend until thighs parallel or below",
    "Touch elbows to inside of knees at bottom",
    "Drive through heels to stand"
  ],
  "tempo": "2-1-1",
  "common_mistakes": [
    "Heels lifting off floor",
    "Rounding back at bottom",
    "Knees caving in"
  ],
  "cues": [
    "Elbows touch knees at bottom",
    "Push knees out with elbows",
    "Sit to a hidden chair"
  ],
  "advantages": [
    "Excellent for teaching squat pattern",
    "Torso forced upright",
    "Light spinal load"
  ],
  "hypertrophy_rep_range": {
    "min": 6,
    "max": 12
  },
  "rest_time": {
    "min_seconds": 90,
    "max_seconds": 120,
    "label": "90-120s"
  },
  "breathing": "Brace and hold breath through descent, exhale at top of ascent",
  "alternatives": [],
  "movement_plane": "sagittal",
  "stability_requirement": "high",
  "skill_requirement": "low",
  "fatigue_score": 6.0,
  "systemic_fatigue": "high",
  "joint_stress": {
    "overall": "high",
    "notes": ""
  },
  "force_curve": "flat",
  "resistance_profile": "constant",
  "unilateral_bilateral": "bilateral",
  "recommended_rir": {
    "min": 2,
    "max": 3,
    "description": "Leave 2-3 reps in reserve for safety"
  },
  "muscle_contributions": [
    {
      "muscle_id": "quadriceps",
      "percentage": 34.5
    },
    {
      "muscle_id": "gluteus_maximus",
      "percentage": 34.5
    },
    {
      "muscle_id": "core",
      "percentage": 10.3
    },
    {
      "muscle_id": "erector_spinae",
      "percentage": 10.3
    },
    {
      "muscle_id": "hamstrings",
      "percentage": 10.3
    }
  ],
  "tags": [],
  "knowledge_version": "1.0.0",
  "last_updated": "2026-07-02",
  "references": []
}
