{
  "id": "back_lat_pulldown",
  "name": "Lat Pulldown",
  "category": "back",
  "primary_muscles": [
    "latissimus_dorsi",
    "trapezius"
  ],
  "secondary_muscles": [
    "biceps_brachii",
    "rhomboids",
    "posterior_deltoid"
  ],
  "equipment": "cable",
  "difficulty": "beginner",
  "movement_pattern": "vertical_pull",
  "mechanics": "compound",
  "setup": [
    "Sit at lat pulldown machine, thighs under pads",
    "Grip bar wider than shoulder-width (wide or medium)",
    "Lean back slightly (~15 degrees), chest up"
  ],
  "execution": [
    "Pull bar to upper chest, elbows drive down and back",
    "Squeeze lats at bottom",
    "Control bar up to full arm extension (no heavy eccentrics)"
  ],
  "tempo": "2-1-3",
  "common_mistakes": [
    "Leaning too far back (turns into row)",
    "Using body momentum to move weight",
    "Not going to full stretch at top",
    "Pulling bar behind the neck (shoulder strain)"
  ],
  "cues": [
    "Elbows point down and back",
    "Imagine crushing an orange in your armpits",
    "Bar touches upper chest, not neck"
  ],
  "variations": [
    "wide_grip_lat_pulldown",
    "close_grip_pulldown",
    "reverse_grip_pulldown"
  ],
  "alternatives": [
    "pull_up",
    "assisted_pull_up"
  ],
  "hypertrophy_rep_range": {
    "min": 6,
    "max": 12
  },
  "rest_time": {
    "min_seconds": 90,
    "max_seconds": 120,
    "label": "90-120s"
  },
  "breathing": "Exhale on concentric, inhale on eccentric",
  "movement_plane": "sagittal",
  "stability_requirement": "moderate",
  "skill_requirement": "low",
  "fatigue_score": 6.0,
  "systemic_fatigue": "high",
  "joint_stress": {
    "overall": "moderate",
    "notes": ""
  },
  "force_curve": "ascending",
  "resistance_profile": "ascending",
  "unilateral_bilateral": "bilateral",
  "recommended_rir": {
    "min": 2,
    "max": 3,
    "description": "Leave 2-3 reps in reserve for safety"
  },
  "muscle_contributions": [
    {
      "muscle_id": "latissimus_dorsi",
      "percentage": 34.5
    },
    {
      "muscle_id": "trapezius",
      "percentage": 34.5
    },
    {
      "muscle_id": "biceps_brachii",
      "percentage": 10.3
    },
    {
      "muscle_id": "rhomboids",
      "percentage": 10.3
    },
    {
      "muscle_id": "posterior_deltoid",
      "percentage": 10.3
    }
  ],
  "tags": [],
  "knowledge_version": "1.0.0",
  "last_updated": "2026-07-02",
  "references": []
}
