{
  "id": "biceps_db_curl",
  "name": "Dumbbell Bicep Curl",
  "category": "biceps",
  "primary_muscles": [
    "biceps_brachii"
  ],
  "secondary_muscles": [
    "brachialis",
    "forearms"
  ],
  "equipment": "dumbbell",
  "difficulty": "beginner",
  "movement_pattern": "elbow_flexion",
  "mechanics": "isolation",
  "setup": [
    "Stand with dumbbells at sides, palms facing in",
    "Elbows pinned to ribs"
  ],
  "execution": [
    "Curl dumbbells to shoulders, supinating palms (turn to face you)",
    "Squeeze at top",
    "Lower under control"
  ],
  "tempo": "2-1-3",
  "common_mistakes": [
    "Swinging body",
    "Not supinating at top (full bicep contraction)",
    "Elbows drifting forward"
  ],
  "cues": [
    "Rotate pinky up at the top",
    "Pause and squeeze at the peak"
  ],
  "variations": [
    "alternating_curl",
    "hammer_curl",
    "incline_curl"
  ],
  "aliases": [
    "DB Bicep Curl"
  ],
  "hypertrophy_rep_range": {
    "min": 8,
    "max": 15
  },
  "rest_time": {
    "min_seconds": 60,
    "max_seconds": 90,
    "label": "60-90s"
  },
  "breathing": "Exhale on concentric, inhale on eccentric",
  "alternatives": [],
  "movement_plane": "multi_planar",
  "stability_requirement": "low",
  "skill_requirement": "low",
  "fatigue_score": 3.0,
  "systemic_fatigue": "low",
  "joint_stress": {
    "overall": "moderate",
    "notes": ""
  },
  "force_curve": "flat",
  "resistance_profile": "constant",
  "unilateral_bilateral": "bilateral",
  "recommended_rir": {
    "min": 2,
    "max": 3,
    "description": "Leave 2-3 reps in reserve for safety"
  },
  "muscle_contributions": [
    {
      "muscle_id": "biceps_brachii",
      "percentage": 62.5
    },
    {
      "muscle_id": "brachialis",
      "percentage": 18.8
    },
    {
      "muscle_id": "forearms",
      "percentage": 18.8
    }
  ],
  "tags": [],
  "knowledge_version": "1.0.0",
  "last_updated": "2026-07-02",
  "references": []
}
