{
  "id": "hamstrings_leg_curl",
  "name": "Lying Leg Curl (Machine)",
  "category": "hamstrings_glutes",
  "primary_muscles": [
    "hamstrings"
  ],
  "secondary_muscles": [
    "gastrocnemius"
  ],
  "equipment": "machine",
  "difficulty": "beginner",
  "movement_pattern": "knee_flexion",
  "mechanics": "isolation",
  "setup": [
    "Lie face down on machine, knees just off pad",
    "Roller pad behind ankles (above heel)",
    "Grip handles, hips pressed into bench"
  ],
  "execution": [
    "Curl weight toward glutes by flexing knees",
    "Squeeze hamstrings at peak contraction",
    "Lower under control to full extension"
  ],
  "tempo": "2-1-3",
  "common_mistakes": [
    "Hips lifting off bench (using momentum)",
    "Partial range of motion",
    "Dropping weight (no eccentric control)",
    "Using upper body to pull"
  ],
  "cues": [
    "Hips stay glued to the bench",
    "Kick your heels to your glutes",
    "Control the negative — slow and deliberate"
  ],
  "variations": [
    "seated_leg_curl",
    "single_leg_curl",
    "standing_leg_curl"
  ],
  "alternatives": [
    "rdl",
    "nordic_curl",
    "hyperextension"
  ],
  "hypertrophy_rep_range": {
    "min": 8,
    "max": 15
  },
  "rest_time": {
    "min_seconds": 60,
    "max_seconds": 90,
    "label": "60-90s"
  },
  "breathing": "Exhale on concentric, inhale on eccentric",
  "movement_plane": "multi_planar",
  "stability_requirement": "low",
  "skill_requirement": "low",
  "fatigue_score": 3.0,
  "systemic_fatigue": "low",
  "joint_stress": {
    "overall": "low",
    "notes": ""
  },
  "force_curve": "flat",
  "resistance_profile": "linear_variable",
  "unilateral_bilateral": "bilateral",
  "recommended_rir": {
    "min": 2,
    "max": 3,
    "description": "Leave 2-3 reps in reserve for safety"
  },
  "muscle_contributions": [
    {
      "muscle_id": "hamstrings",
      "percentage": 76.9
    },
    {
      "muscle_id": "gastrocnemius",
      "percentage": 23.1
    }
  ],
  "tags": [],
  "knowledge_version": "1.0.0",
  "last_updated": "2026-07-02",
  "references": []
}
