{
  "id": "cardio_ski_erg",
  "name": "SkiErg",
  "category": "cardio",
  "primary_muscles": [
    "cardiovascular",
    "lats",
    "shoulders"
  ],
  "secondary_muscles": [
    "core",
    "triceps",
    "glutes"
  ],
  "equipment": "ski_erg",
  "difficulty": "beginner",
  "movement_pattern": "full_body_cardio",
  "mechanics": "compound",
  "hypertrophy_rep_range": {
    "min": 6,
    "max": 12
  },
  "rest_time": {
    "min_seconds": 90,
    "max_seconds": 120,
    "label": "90-120s"
  },
  "breathing": "Exhale on concentric, inhale on eccentric",
  "cues": [],
  "common_mistakes": [],
  "alternatives": [],
  "tempo": "2-1-2",
  "movement_plane": "multi_planar",
  "stability_requirement": "moderate",
  "skill_requirement": "low",
  "fatigue_score": 6.0,
  "systemic_fatigue": "high",
  "joint_stress": {
    "overall": "moderate",
    "notes": ""
  },
  "force_curve": "flat",
  "resistance_profile": "constant",
  "unilateral_bilateral": "bilateral",
  "recommended_rir": {
    "min": 2,
    "max": 3,
    "description": "Leave 2-3 reps in reserve for safety"
  },
  "muscle_contributions": [
    {
      "muscle_id": "cardiovascular",
      "percentage": 25.6
    },
    {
      "muscle_id": "lats",
      "percentage": 25.6
    },
    {
      "muscle_id": "shoulders",
      "percentage": 25.6
    },
    {
      "muscle_id": "core",
      "percentage": 7.7
    },
    {
      "muscle_id": "triceps",
      "percentage": 7.7
    },
    {
      "muscle_id": "glutes",
      "percentage": 7.7
    }
  ],
  "tags": [],
  "knowledge_version": "1.0.0",
  "last_updated": "2026-07-02",
  "references": []
}
