{
  "id": "back_face_pull",
  "name": "Face Pull",
  "category": "back",
  "primary_muscles": [
    "posterior_deltoid",
    "trapezius",
    "rhomboids"
  ],
  "secondary_muscles": [
    "infraspinatus",
    "teres_minor"
  ],
  "equipment": "cable",
  "difficulty": "beginner",
  "movement_pattern": "horizontal_pull",
  "mechanics": "compound",
  "setup": [
    "Set cable pulley at upper-chest height",
    "Attach rope handle",
    "Grip with palms facing each other, step back for tension"
  ],
  "execution": [
    "Pull rope toward your face, separating ends",
    "External rotate shoulders (hands move back, knuckles go back)",
    "Squeeze rear delts and upper back at peak",
    "Control back to start"
  ],
  "tempo": "2-1-2",
  "common_mistakes": [
    "Pulling to chin instead of eyes/forehead",
    "Not separating the rope at the end",
    "Using too heavy weight (loses form)",
    "Leaning back (turns into upright row)"
  ],
  "cues": [
    "Break the rope in half",
    "Hands finish behind your head",
    "Shoulder health — do these every session!"
  ],
  "recommendation": "Do 3-4 sets of 15-20 at least 3x/week for shoulder health",
  "hypertrophy_rep_range": {
    "min": 6,
    "max": 12
  },
  "rest_time": {
    "min_seconds": 90,
    "max_seconds": 120,
    "label": "90-120s"
  },
  "breathing": "Exhale on concentric, inhale on eccentric",
  "alternatives": [],
  "movement_plane": "sagittal",
  "stability_requirement": "moderate",
  "skill_requirement": "low",
  "fatigue_score": 6.0,
  "systemic_fatigue": "high",
  "joint_stress": {
    "overall": "moderate",
    "notes": ""
  },
  "force_curve": "ascending",
  "resistance_profile": "ascending",
  "unilateral_bilateral": "bilateral",
  "recommended_rir": {
    "min": 2,
    "max": 3,
    "description": "Leave 2-3 reps in reserve for safety"
  },
  "muscle_contributions": [
    {
      "muscle_id": "posterior_deltoid",
      "percentage": 27.8
    },
    {
      "muscle_id": "trapezius",
      "percentage": 27.8
    },
    {
      "muscle_id": "rhomboids",
      "percentage": 27.8
    },
    {
      "muscle_id": "infraspinatus",
      "percentage": 8.3
    },
    {
      "muscle_id": "teres_minor",
      "percentage": 8.3
    }
  ],
  "tags": [],
  "knowledge_version": "1.0.0",
  "last_updated": "2026-07-02",
  "references": []
}
